category,datetime,headline,id,image,related,source,summary,url,date
company,1730548885,"Pomerantz Law Firm Investigates Claims On Behalf of Investors of Tesla, Inc. - TSLA",131006068,,TSLA,Finnhub,"NEW YORK, Nov. 2, 2024 /PRNewswire/ -- Pomerantz LLP is investigating claims on behalf of investors of  Tesla, Inc.  . Such investors are advised to contact Danielle Peyton at...",https://finnhub.io/api/news?id=d3251d53154e1c1ddcb513881a5291770fe8be7363349e859c52748c8e39debd,2024-11-02
company,1730537460,Elon Musk Predicts AI to Surpass Human Capabilities Within Five Years,131010899,,TSLA,GuruFocus,Looking for stock market analysis and research with proves results? Zacks.com offers in-depth financial research with over 30years of proven results.,https://finnhub.io/api/news?id=94f3e051db95dc7990e7473473069b2c1011ee7a9c8dba0ace900bbbd9b5255a,2024-11-02
company,1730535960,"Benzinga Bulls And Bears: Tesla, Alphabet, Trump Media, Super Micro — Trader Predicts Dogecoin Rally Above 20 Cents In November",131007432,,TSLA,Benzinga,Looking for stock market analysis and research with proves results? Zacks.com offers in-depth financial research with over 30years of proven results.,https://finnhub.io/api/news?id=75259d41e7c41aab0398e525304bc447bc54d9aed3e001775724e1605540bd29,2024-11-02
company,1730520660,EU Tariff on Chinese EVs Sparks Economic Concerns and Trade Tensions,131010901,,TSLA,GuruFocus,Looking for stock market analysis and research with proves results? Zacks.com offers in-depth financial research with over 30years of proven results.,https://finnhub.io/api/news?id=d2b6cb1344e85efb02d1cb1bdfc51514d194879efcb6b55d4a82f7289e15911d,2024-11-02
company,1730514600,SA Asks: Which consumer stocks could rise or fall on a Trump win?,131012670,,TSLA,Seeking Alpha,Looking for stock market analysis and research with proves results? Zacks.com offers in-depth financial research with over 30years of proven results.,https://finnhub.io/api/news?id=56671c09d3735e300f866ca51984643740ee09a1df4c7c047d905e633a223881,2024-11-02
company,1730514060,Honda's Pickup Beats Tesla Cybertruck As Most American Made Truck,131005941,,TSLA,Benzinga,Looking for stock market analysis and research with proves results? Zacks.com offers in-depth financial research with over 30years of proven results.,https://finnhub.io/api/news?id=3a96c82360ae2ae7913682e02abebdcba80845535b0fc05d88a7d25c6ec7d373,2024-11-02
company,1730509200,Why Elon Musk’s Robotaxi Dreams Are Premature,130990875,https://s.yimg.com/ny/api/res/1.2/y90foFD45Kyu3wymp0qswQ--/YXBwaWQ9aGlnaGxhbmRlcjt3PTEyMDA7aD02MDA-/https://media.zenfs.com/en/wsj.com/49050f3836007d4165cce1a21afd7dda,TSLA,Yahoo,Tesla is pushing to build true self-driving vehicles by 2026. The way its CEO wants to do it seems risky.,https://finnhub.io/api/news?id=c60c29e7e91a340d292d279d80251cb6f973e1520b3bf4d204465326cf49c2fb,2024-11-02
company,1730495940,You Won't Believe What Elon Musk Just Said About Tesla,130973851,https://g.foolcdn.com/editorial/images/795579/gettyimages-1083077280.jpg,TSLA,Yahoo,Elon Musk just told investors that he thinks Tesla will emerge as the world's most valuable company.,https://finnhub.io/api/news?id=665b3b6ea6299af668da77c657a3f2d654b5b244246e0b27e9350ba89661c054,2024-11-01
company,1730493154,Tesla Sells $499 Million of Debt Backed by Solar Equipment Loans,130973860,https://s.yimg.com/ny/api/res/1.2/2BNKLx7qotNKobItsMgtDA--/YXBwaWQ9aGlnaGxhbmRlcjt3PTEyMDA7aD02NzQ-/https://media.zenfs.com/en/bloomberg_markets_842/1653cd932e3bbcc31307ef7f30a2cffa,TSLA,Yahoo,"(Bloomberg) -- Tesla Inc. sold $499 million of bonds backed by loans offered to customers buying solar equipment.Most Read from BloombergIs Denver’s Big Bet on E-Bikes Paying Off?The Answer To Making Cities More Family-Friendly? CourtyardsChicago Mayor Seeks Property Tax Hike, Breaking Campaign VowIstanbul Tries Free Public Transit to Help Job SeekersIn Warsaw, Falling Road Deaths Signal a Traffic Safety TurnaroundDeutsche Bank began marketing the five-tranche deal on Monday and the process wrap",https://finnhub.io/api/news?id=336dd6be94471576524994f62849cf094dceff6e6fdd020fc244c3814c1a34ff,2024-11-01
company,1730480503,Catherine Wood's Strategic Moves in Q3 2024: A Deep Dive into Zoom Video Communications' ...,130963381,https://s.yimg.com/ny/api/res/1.2/K_gE6JJVDrxVWiU.FWNeGQ--/YXBwaWQ9aGlnaGxhbmRlcjt3PTEyMDA7aD04NzE-/https://media.zenfs.com/en/us.finance.gurufocus/a07c4b6776676630f4981c788f250546,TSLA,Yahoo,Insights from ARK Investment Management's Latest 13F Filing,https://finnhub.io/api/news?id=e94a6ef8adc3aa80a50f228cd6f11d693daa545e7ecd13274cbc4c46e1050a49,2024-11-01
company,1730480311,"In 2016, Elon Musk Said It's 'Terrible To Make A Profit On Service.' Now, Repairs, Parts And Superchargers Are Beginning To Drive Its Profits",130967284,https://media.zenfs.com/en/Benzinga/9618071415eb73e4ffde06d9ece949b7,TSLA,Yahoo,"In 2016, Elon Musk said something that might surprise you today: “Our philosophy with respect to service is not to profit from service. I think that it's terrible to make a profit on service.” By 2024, however, it appears that things are going the other way. As Electrek’s Fred Lambert reports, a significant portion of Tesla’s revenue comes from auto repairs, components and its network of Superchargers – exactly the sectors Musk had insisted would not be centered on profit. Don't Miss: This Adobe",https://finnhub.io/api/news?id=3cdadec32beafdbd0ae806dcd5290cc21a42bcb6b7640bbc617939fa6ef42840,2024-11-01
company,1730475837,"How One Investor Made Retirement Happen With $61,600 In Annual Dividends",130966897,https://media.zenfs.com/en/benzinga_79/a46bc7d04dda944144d8269769c60772,TSLA,Yahoo,"Dividend investing is an approach to building wealth over the long term. By investing in companies that consistently pay dividends to their shareholders, investors can benefit from a steady stream of income while potentially growing their principal ...",https://finnhub.io/api/news?id=127866ba80817bc30be07d0c707eafa227eab3a3cf84ebe4466c905dd41ec324,2024-11-01
company,1730474828,"Is Tesla, Inc. (TSLA) Set to Explode in 2025?",130967287,,TSLA,Yahoo,"We recently compiled a list of the 10 Stocks Set to Explode in 2025. In this article, we are going to take a look at where Tesla, Inc. (NASDAQ:TSLA) stands against the other stocks set to explode in 2025. “Big Technology are The New Defensives” Strategist Says As the Magnificent Seven continues to release earnings for […]",https://finnhub.io/api/news?id=3e533be42877fa69d33cf2673d1726c09acd0ffd42bed6d445de5c7cebd71222,2024-11-01
company,1730473079,Elon Musk Discovers Tesla Cybertruck's Biggest Enthusiast in Shaquille O'Neal,130967292,,TSLA,Yahoo,NBA Legend Takes Delivery of Third Custom Tesla Cybertruck,https://finnhub.io/api/news?id=696485e6292914b6cb0e5e63ab4446a42bfb47899d15f9a7042beeecc185462b,2024-11-01
company,1730472840,BYD’s Sales Hit a Record. It’s Neck and Neck in EV Race With Tesla.,130967295,,TSLA,Yahoo,"The Chinese manufacturer sold more than 500,000 passenger vehicles in a month for the first time in October.",https://finnhub.io/api/news?id=0e292f060ab82edac1177464ab32c773a0eeb3b2833c3ecd4781c19770d91fe5,2024-11-01
company,1730472744,Musk tests the role of money in U.S. politics with multimillion-dollar effort to back Trump,130973883,https://s.yimg.com/ny/api/res/1.2/CKRK2E4LM6561sJsac3vqg--/YXBwaWQ9aGlnaGxhbmRlcjt3PTEyMDA7aD04MDA-/https://media.zenfs.com/en/ap_finance_articles_694/1825c0380891d52de809df2dc1bd9c36,TSLA,Yahoo,"And The Wall Street Journal recently reported that Musk regularly communicates with Russian President Vladimir Putin, a potential national security risk because SpaceX, his aerospace company, holds billions of dollars worth of contracts with NASA and the Department of Defense. Musk is hardly the only person whose megawealth places him at the nexus of politics, business and foreign policy. But few are working so publicly for a single candidate as Musk, whose expansive business ties and growing bravado pose a vexing test of one unelected person's political power.",https://finnhub.io/api/news?id=f1b169d43ee4fc4cfe716b0c7985a879c196c7878c9c95917802ab047c7f5dbb,2024-11-01
company,1730469960,Why Elon Musk and His Silicon Valley Allies Now Want Trump to Win,130967299,https://s.yimg.com/ny/api/res/1.2/l5cspBEAAl7576hWRnXkZg--/YXBwaWQ9aGlnaGxhbmRlcjt3PTEyMDA7aD02NzU-/https://media.zenfs.com/en/wall_street_journal_733/e3a2fd81b5c3ad89dd2247b0ee33ed78,TSLA,Yahoo,"Big tech overwhelmingly leans blue, but a small faction of leaders, including Elon Musk, has begun lending their influence and pocketbooks to support Donald Trump. WSJ explains what is behind the shift.",https://finnhub.io/api/news?id=62bf260bcc96b0ed4214b1ef0a722200105fa079ad0d986506c46d09bd2b2724,2024-11-01
company,1730469197,"Enphase Energy: Disappointing, But Not As Bad As It Seems",130963839,https://static.seekingalpha.com/cdn/s3/uploads/getty_images/1781790467/image_1781790467.jpg?io=getty-c-w1536,TSLA,SeekingAlpha,"Enphase Energy continues to focus on its business fundamentals, working with installers, expanding to new geographies and launching new products. Read more about recent earnings.",https://finnhub.io/api/news?id=295d0509c183c8cedb21f8be4659728266e9033d7e97fcfc3f3ebedaf9561df4,2024-11-01
company,1730468993,Trump Vs. Harris: Top Stocks To Buy Or Avoid For The November 2024 Election,130963841,https://static.seekingalpha.com/cdn/s3/uploads/getty_images/475956537/image_475956537.jpg?io=getty-c-w1536,TSLA,SeekingAlpha,"Regardless of who wins the Presidential Election, investors can benefit if they choose the right investments. Click here to read my detailed report.",https://finnhub.io/api/news?id=e52c0c482f80de678bc7fb48a1d72dccdf4c898b855c71e3dd6ac6c900c34895,2024-11-01
company,1730466540,Don’t Let Tesla’s Big Moves Fool You. Where the Chart Says the Stock Is Heading Next.,130967302,,TSLA,Yahoo,The automakers shares look like they will fail to close above a key level for two conesutive weeks. That is a bad sign.,https://finnhub.io/api/news?id=dfa434f42ad050668dc3c1670f9b27ce95cf69f84814a7c6b62f0af112465b53,2024-11-01
company,1730466067,"Cathie Wood Shuffles Her Tech Deck: Continues Dumping Tesla And Palantir, Stocks Up On AMD And Meta",130965500,https://media.zenfs.com/en/benzinga_79/38a2ce028e5d2375e09cf29fdc74b1ef,TSLA,Yahoo,"On Wednesday, Cathie Wood-led Ark Invest made some significant trades, with the most notable ones involving Tesla Inc (TSLA), Advanced Micro Devices Inc (AMD), and Palantir Technologies Inc (PLTR). The Tesla Trade: Ark Invest’s ARK Innovation ETF ...",https://finnhub.io/api/news?id=11e46689959903c1033ab82d5e0f46205996cb3fabffa058032b77dc813b808f,2024-11-01
company,1730465820,Tesla’s (NASDAQ:TSLA) Tech Developments Are Not Enough to Stop Share Slide,130992811,,TSLA,TipRanks,Looking for stock market analysis and research with proves results? Zacks.com offers in-depth financial research with over 30years of proven results.,https://finnhub.io/api/news?id=a7abf730534bc861b3943a71736c330e89feb9eb479a78ee4a32a1ec49b827f1,2024-11-01
company,1730465700,Tesla (NASDAQ:TSLA) Slips as Tech Developments Rise,130992813,,TSLA,TipRanks,Looking for stock market analysis and research with proves results? Zacks.com offers in-depth financial research with over 30years of proven results.,https://finnhub.io/api/news?id=ad35b7bda87097de7e99c4f6d29ccc72546b67623b50f676248d72751eb43122,2024-11-01
company,1730464380,Tesla’s (NASDAQ:TSLA) Slips as Tech Developments Rise,130992816,,TSLA,TipRanks,Looking for stock market analysis and research with proves results? Zacks.com offers in-depth financial research with over 30years of proven results.,https://finnhub.io/api/news?id=f8bca87060c8ec385dfb5757c3b8e793becb96843c9310c7e88c779f0480c65a,2024-11-01
company,1730461440,Tesla Investor Says EV Giant Will 'Admit' It Needs Lidar Despite Elon Musk Calling It A Crutch,130992817,,TSLA,Benzinga,Looking for stock market analysis and research with proves results? Zacks.com offers in-depth financial research with over 30years of proven results.,https://finnhub.io/api/news?id=4869d6006961da1660be2bdac17db5baafb717139a3dce44044c54062a6ccf42,2024-11-01
company,1730456280,Should Investors Chase The Rally In Amazon's Stock After Q3 Earnings?,130992820,,TSLA,TalkMarkets,Looking for stock market analysis and research with proves results? Zacks.com offers in-depth financial research with over 30years of proven results.,https://finnhub.io/api/news?id=3b2b7ac2038917da936250af7455171de56ac3aced63c8497daf8e9c0c54b3e7,2024-11-01
company,1730450580,Election 2024: Where To Put Your Money Ahead of the Vote,130958304,,TSLA,Thefly.com,Looking for stock market analysis and research with proves results? Zacks.com offers in-depth financial research with over 30years of proven results.,https://finnhub.io/api/news?id=a4fe9fde11f7856d60adf12d672661cbdffa47243d91dbd91d1095da68b914d1,2024-11-01
company,1730449080,"Zacks Investment Ideas feature highlights: Alphabet, Tesla, Advanced Micro Devices, Root and Carvana",130965507,https://media.zenfs.com/en/zacks.com/30e90ac213ebedcfe9ef1b79c529169c,TSLA,Yahoo,"Alphabet, Tesla, Advanced Micro Devices, Root and Carvana have been highlighted in this Investment Ideas article.",https://finnhub.io/api/news?id=e53ea1034e12fa1d0e114ec9e5939d85471e3d988762ea8737445209a067167e,2024-11-01
company,1730443680,"EV sales blaze hot for BYD, Li Auto, XPeng, ZEEKR, and NIO",130958627,,TSLA,Seeking Alpha,Looking for stock market analysis and research with proves results? Zacks.com offers in-depth financial research with over 30years of proven results.,https://finnhub.io/api/news?id=1c0c9d2ef00acaf1aeea9bc3a1001dc1695c5f16a003c8bec0051877baae8cc8,2024-11-01
company,1730443238,"Cathie Wood Bets Big On Mark Zuckerberg: Ark Pours $19M Into Meta Shares, Dumps Palantir And Tesla Stock",130943944,https://media.zenfs.com/en/Benzinga/a9241cfb42c69c45ee661f1f850c5333,TSLA,Yahoo,"On Thursday, the Cathie Wood-led Ark Invest made significant moves in the market, with prominent trades involving Tesla Inc. (NASDAQ:TSLA), Meta Platforms Inc. (NASDAQ:META), Palantir Technologies Inc. (NYSE:PLTR) and Block Inc (NYSE:SQ). The Tesla Trade: Ark Invest’s ARK Innovation ETF (NYSE:ARKK) and ARK Next Generation Internet ETF (NYSE:ARKW) sold a total of 8,384 shares of the Elon Musk-led company. With Tesla’s closing price at $249.85 on Thursday, the value of this trade amounts to approx",https://finnhub.io/api/news?id=f77ae2e49c57920792fe2788ed4d70f4dfaddf8ae62ef2cbfd8298d8fe9596d6,2024-11-01
company,1730442600,Musk has now sunk nearly $120 million into effort to elect Trump,131075719,,TSLA,MarketWatch,Musk has now sunk nearly $120 million into effort to elect Trump,https://finnhub.io/api/news?id=ca544591e6ac0b25372ba8d4bfcf578834dbfd07b9745ff38b0de49f190f99d6,2024-11-01
company,1730440921,Tesla Set To Lose Its BEV Crown As BYD Sales Surge In October,131042655,,TSLA,DowJones,Tesla Set To Lose Its BEV Crown As BYD Sales Surge In October,https://finnhub.io/api/news?id=2251b080b23197a4391d8d77f06cb1ab2d4b34eef1664f268229de285031ed9f,2024-11-01
company,1730440260,Tesla (TSLA) Issues $499 Million Bond Backed by Solar Equipment Loans,130992826,,TSLA,GuruFocus,Looking for stock market analysis and research with proves results? Zacks.com offers in-depth financial research with over 30years of proven results.,https://finnhub.io/api/news?id=b67ec8869a3629f43bf89aa038dbe16547cefde6158654d390f47f429935cc49,2024-11-01
company,1730439900,Breaking Down Magnificent 7 Earnings Results,130984316,,TSLA,TalkMarkets,Looking for stock market analysis and research with proves results? Zacks.com offers in-depth financial research with over 30years of proven results.,https://finnhub.io/api/news?id=7bf4e58b6ec8f80cb16eac9da9c06531b82c1daf0a4059749de50a09a1eea645,2024-11-01
company,1730439720,"QQQ ETF Update, 11/1/2024",130960164,,TSLA,TipRanks,Looking for stock market analysis and research with proves results? Zacks.com offers in-depth financial research with over 30years of proven results.,https://finnhub.io/api/news?id=b5732245fcf20c4cf5a78d7f04aa3abfdc1f1a83638444ac4da101fa4d19fb69,2024-11-01
company,1730439060,"Tesla Inc. stock falls Friday, underperforms market",131075723,,TSLA,MarketWatch,"Tesla Inc. stock falls Friday, underperforms market",https://finnhub.io/api/news?id=b398bbb5d84b67baa757d15b02805c4b43a0851441fec4b5de928770e70c8d65,2024-11-01
company,1730434320,Ford F-150 Lightning Pickup Truck Production To Be Halted Temporarily After Tesla's Cybertruck Races Ahead In Q3,130960532,,TSLA,Benzinga,Looking for stock market analysis and research with proves results? Zacks.com offers in-depth financial research with over 30years of proven results.,https://finnhub.io/api/news?id=7fd29a4f6b574321547437486a6594d26eaa19836c5f0c6bdd52ff46565c03ac,2024-11-01
company,1730434260,Tesla (TSLA) Sells $499 Million Solar-Backed Bonds with High Demand,130992834,,TSLA,GuruFocus,Looking for stock market analysis and research with proves results? Zacks.com offers in-depth financial research with over 30years of proven results.,https://finnhub.io/api/news?id=bc5c33bc8f5b3224f0197edb8e1759c7ddeccc404b07985ea85f18782f55408c,2024-11-01
company,1730433120,"Market Volatility Soars Ahead Of Elections, Tech Earnings Mixed, Strikes And Hurricanes Knock Employment Down: This Week In The Markets",130972220,,TSLA,Benzinga,Looking for stock market analysis and research with proves results? Zacks.com offers in-depth financial research with over 30years of proven results.,https://finnhub.io/api/news?id=abd1a1c9c474d47453e0ca13700ebac79408ae375746cdfdf6ae2c42e45a3a91,2024-11-01
company,1730426460,"Tesla Can Make Cybercab For The Same Money It Takes Waymo To Install Lidar Sensors On Its Robotaxi, Says Ark Analyst",130942416,,TSLA,Benzinga,Looking for stock market analysis and research with proves results? Zacks.com offers in-depth financial research with over 30years of proven results.,https://finnhub.io/api/news?id=15ac6da6518b0bd9b73c1a204296c67fc139a05ccf5fd928b9aa096de4737d71,2024-11-01
company,1730421017,Election 2024 And Your Portfolio: How Harris Vs. Trump Race Impacts The Stock Market,131039873,,TSLA,DowJones,Election 2024 And Your Portfolio: How Harris Vs. Trump Race Impacts The Stock Market,https://finnhub.io/api/news?id=91eadcbbb65e30d7273a82abddf8022bd48627dde9a12caa91a2d54bbd84f1a3,2024-11-01
company,1730417211,Judge aims to rule on Elon Musk's $56 billion Tesla pay by year end,130927851,https://media.zenfs.com/en/reuters.com/8963cff3d8b3948e66f950ce20549b42,TSLA,Yahoo,"The Delaware judge considering whether a vote by Tesla shareholders reinstated Elon Musk's $56 billion pay package which the court had voided will try to issue a ruling this year, according to the judge's letter to the lawyers in the case.  ""I write to inform you that I aim to issue that decision before the end of this year,"" said the letter from Kathaleen McCormick, the chancellor on Delaware's Court of Chancery.  Musk's 2018 pay package of stock options is by far the largest ever in corporate America.",https://finnhub.io/api/news?id=a2c0d17dffd1509973fbaa56f2af77fddc7d144e7c164d24c23274584f97da1c,2024-10-31
company,1730415055,Dow Jones Rallies On Surprise Jobs Report; Apple Slides On Earnings,131038082,,TSLA,DowJones,Dow Jones Rallies On Surprise Jobs Report; Apple Slides On Earnings,https://finnhub.io/api/news?id=545ede2bcf4676603989e0b13bc144cb84b5c05eb79e96447ed08a20a8f7d534,2024-10-31
company,1730413818,Tracking Cathie Wood's ARK Invest 13F Portfolio - Q3 2024 Update,130931961,https://static.seekingalpha.com/cdn/s3/uploads/getty_images/186805810/image_186805810.jpg?io=getty-c-w1536,TSLA,SeekingAlpha,"Read here for an update on ARK Invest's latest 13F portfolio changes, including reductions in large positions and top holdings in Tesla, Roku, and Coinbase Global.",https://finnhub.io/api/news?id=559a82c0276fb5331db7f8cd86daba5de18e7559852ae0fb6b25103b24f9629d,2024-10-31
company,1730408576,"Dow Jones Futures Rise; Amazon Jumps, Jobs Report Looms After Market Sell-Off",131038084,,TSLA,DowJones,"Dow Jones Futures Rise; Amazon Jumps, Jobs Report Looms After Market Sell-Off",https://finnhub.io/api/news?id=589541c343a909baedf40ed59a1fc88fa2facb6c8b5b03400d9540cbae9fb70d,2024-10-31
company,1730407266,Musk Ordered to Philadelphia Hearing Over $1 Million Voter Sweepstakes,130927856,,TSLA,Yahoo,A Philadelphia judge has mandated Tesla CEO Elon Musk's attendance at a Thursday court hearing,https://finnhub.io/api/news?id=849005a71bffcb6701ed21ea435ef8d43308c0f8bf03255d66245356e9b54b80,2024-10-31
company,1730404451,"Tesla, Inc. (TSLA): Among The 10 Best S&P 500 Stocks to Buy According to Hedge Funds",130921907,https://s.yimg.com/ny/api/res/1.2/.JOU5s7Gq_YOOyACvOPCHw--/YXBwaWQ9aGlnaGxhbmRlcjt3PTEyMDA7aD02NzM-/https://media.zenfs.com/en/insidermonkey.com/b9a4e42d2f02e3e8ea0146a5aa7272f9,TSLA,Yahoo,"We recently compiled a list of the 10 Best S&P 500 Stocks to Buy According to Hedge Funds. In this article, we are going to take a look at where Tesla, Inc. (NASDAQ:TSLA) stands against other S&P 500 stocks. As per AXA Investment Managers, the US dominated financial markets this year. The investment firm believes that […]",https://finnhub.io/api/news?id=6431abd0ef795b9e1044e82abd31e1680a9d72624e9a6c0b8c5ad9d48c28166d,2024-10-31
company,1730399400,Tech Stocks: Staying Ahead Of The Curve,130922682,https://static.seekingalpha.com/cdn/s3/uploads/getty_images/1288440805/image_1288440805.jpg?io=getty-c-w1536,TSLA,SeekingAlpha,What happens when growth numbers for tech names start coming down? Joe Albano and Victor Dergunov dissect recent news and how the Presidential election will affect the sector.,https://finnhub.io/api/news?id=f3e055aff3f52515026fa9c78240d109853e792676ca3afcc7928c820f487d32,2024-10-31
company,1730392354,Elon Musk Slams Zoox Co-Founder Over FSD Criticism: Your Company 'Would Be Dead Already' If Not For Amazon,130911249,https://media.zenfs.com/en/benzinga_79/5382a645f8ed7e7c432ed306c5823a16,TSLA,Yahoo,"Zoox co-founder Jesse Levinson on Wednesday dismissed the possibility of Tesla Inc (NASDAQ:TSLA) deploying autonomous vehicles without safety drivers in California next year, alleging that the EV giant lacks a technology that works. What Happened: ...",https://finnhub.io/api/news?id=6eb669197a8340da083e8882ec04a2002ac0b5619532d5019373ef6c23076b75,2024-10-31
company,1730388833,MicroStrategy’s $21 Billion Equity Plan Tops Tesla for Record,130917771,https://s.yimg.com/ny/api/res/1.2/tH5qVERElf71MW1nO7XnJQ--/YXBwaWQ9aGlnaGxhbmRlcjt3PTEyMDA7aD01MTk-/https://media.zenfs.com/en/bloomberg_markets_842/7325f7096354788139554a9e237b7012,TSLA,Yahoo,"(Bloomberg) -- MicroStrategy Inc. laid out plans to sell a record $21 billion in new shares to add to its stockpile of Bitcoin, opening the door to a program that would far surpass the milestone Elon Musk’s Tesla Inc. set about four years ago.Most Read from BloombergIs Denver’s Big Bet on E-Bikes Paying Off?Chicago Mayor Seeks Property Tax Hike, Breaking Campaign VowThe Answer To Making Cities More Family-Friendly? CourtyardsNY Transit Agency Takes Next Step on Brooklyn-Queens Rail LinkA South K",https://finnhub.io/api/news?id=275a0bd4a75dba63bcec737e4bf901bbf3098f97f9cac518e1056525dfb63f8c,2024-10-31
company,1730386800,What the Election Means for Companies and Sectors,131050310,,TSLA,MarketWatch,What the Election Means for Companies and Sectors,https://finnhub.io/api/news?id=0306f773702918774a432a532437ecbdf0a15728b1d8e087e86bb3db050413e8,2024-10-31
company,1730386080,"Zacks Earnings Trends Highlights: Tesla, Alphabet and Microsoft",130910487,https://media.zenfs.com/en/zacks.com/5d091b3e912681bbeabff8c176ea70a1,TSLA,Yahoo,"Tesla, Alphabet and Microsoft are part of the Zacks Earnings Trends article.",https://finnhub.io/api/news?id=6aaded836a3b8dcb4517dabf3ccffda4f14e0c0af6d15090d3ee5de8ee637838,2024-10-31
company,1730385271,Uber is transitioning into a 'software company': Investor,130900191,https://s.yimg.com/ny/api/res/1.2/Ke0TXNHFOM6CBEA1CD1yyg--/YXBwaWQ9aGlnaGxhbmRlcjt3PTEyMDA7aD02NzY-/https://s.yimg.com/os/creatr-uploaded-images/2024-10/e8743440-978c-11ef-8cbd-e778127f95e7,TSLA,Yahoo,"Uber (UBER) reported third quarter results, beating Wall Street expectations on both revenue and earnings. The rideshare platform posted revenue of $11.19 billion, surpassing estimates of $10.99 billion. Adjusted earnings per share reached $1.20, significantly higher than the anticipated $0.45. Despite these positive metrics, Uber's stock faced pressure due to weaker-than-expected gross bookings and a reduced fourth quarter outlook. Kindred Ventures Founder and managing partner Steve Jang joins Morning Brief to provide insights into Uber's performance and future potential. ""The company is starting to show that it's not just a marketplace company but a software company,"" Jang says, highlighting Uber's profitability and continued growth opportunities. Jang emphasizes Uber's strategic positioning, pointing to potential expansion in autonomous and electric vehicles. He praises the company's cost-consciousness and ability to apply its software network across ridesharing, delivery, and freight services. ""Uber is the demand network,"" Jang states, arguing that emerging technologies like Waymo and Tesla's (TSLA) autonomous vehicles will take time to impact the market. However, Uber's global network, software, and 24/7 operations provide a competitive advantage that these companies may want to use in the future. To watch more expert insights and analysis on the latest market action, check out more Morning Brief here. This post was written by Angel Smith",https://finnhub.io/api/news?id=194f27d31917dff3b0d03449b2ae73b8a9b95f185c9097dff8c289b21c9ed4bf,2024-10-31
