category,datetime,headline,id,image,related,source,summary,url,date
company,1733215440,SpaceX Valuation Makes Musk  $40 Billion. It Offsets a  $100 Billion Loss.,131774737,,TSLA,MarketWatch,SpaceX Valuation Makes Musk  $40 Billion. It Offsets a  $100 Billion Loss.,https://finnhub.io/api/news?id=b8204de67017ae63493813c5a11ef8a52be0d1a844986bfe5cc9e66dd0272b94,2024-12-03
company,1733210933,Elon Musk's $56 Billion Tesla Pay Package Rejected Again By Delaware Judge,131774716,,TSLA,DowJones,Elon Musk's $56 Billion Tesla Pay Package Rejected Again By Delaware Judge,https://finnhub.io/api/news?id=0344b5ddbdfc3b85b45df5f343ebb0e708cbdd31ded5634ce2f6dc3198537344,2024-12-03
company,1733209920,Trump Will Crash the U.S. Dollar and 2 Other Wild Stock Market Predictions for 2025,131774474,,TSLA,MarketWatch,Trump Will Crash the U.S. Dollar and 2 Other Wild Stock Market Predictions for 2025,https://finnhub.io/api/news?id=f8951da903ecf679116ff5d83c7e0d8eb873ef82ebd4971582196879c0ef0b53,2024-12-03
company,1733209440,"Intel Was a Tech Titan, Its Downfall Sends a Warning to Apple, Nvidia, Alphabet. And 5 Other Things to Know Today.",131774475,,TSLA,MarketWatch,"Intel Was a Tech Titan, Its Downfall Sends a Warning to Apple, Nvidia, Alphabet. And 5 Other Things to Know Today.",https://finnhub.io/api/news?id=14293327051cb9546fcaa3d4283e1a41c1a18008537100fd8cfcc06e2ca4cc39,2024-12-03
company,1733209001,"Zscaler's shares fall despite forecast-beating results, and other movers",131774741,,TSLA,MarketWatch,"Zscaler's shares fall despite forecast-beating results, and other movers",https://finnhub.io/api/news?id=b5266fb335bb2252d05c303c2d8ed72429908e9360b983cb5985e8ca975e3572,2024-12-03
company,1733203201,Elon Musk Latest: Tesla Payout Rejected and SpaceX Valuation,131749581,,TSLA,Finnhub,"-- A court again rejected Elon Musk's bumper pay package as Tesla chief executive officer. But over at SpaceX, a tender offer sees the start-up's value rocket to about 350 billion dollars....",https://finnhub.io/api/news?id=fb1ada378e238481db843cbd651a2d25711b98abed0a76153de7550d59f6be50,2024-12-03
company,1733202134,"Buy ‘Magnificent Seven’ on Corrections, NYU’s Damodaran Says",131747114,https://media.zenfs.com/en/bloomberg_markets_842/32b2e8762ad4aedb4ec24ea28fde1891,TSLA,Yahoo,"(Bloomberg) -- The “Magnificent Seven” stocks are a buy during corrections as most of them will keep generating money, according to a New York University professor known for his expertise on valuations.Most Read from BloombergRiyadh Metro Partially Opens in Bid to Ease City’s Traffic JamsAs Wars Rage, Cities Face a Dark New Era of Urban Destruction“As a value investor, I have never seen cash machines as lucrative as these companies are,” Aswath Damodaran, a finance professor at NYU’s Stern Schoo",https://finnhub.io/api/news?id=ec07e6ac106e50ba4a7a92e2108d975caf323a1420e49eecdeb8d58efc8c9de5,2024-12-03
company,1733202071,Tesla's China Sales Fall as Competition Heats Up,131749424,,TSLA,Finnhub,"By Jiahui Huang Tesla's sales in China fell in November amid intensifying competition from Chinese rivals. The U.S. electric-vehicle maker sold 78,856 China-made cars in November, down 4.3%...",https://finnhub.io/api/news?id=d3b82c1c5fe505c82dfbb5efb265c84487cf64c6b7fcaf39015afe6a96c969e6,2024-12-03
company,1733201580,Tesla’s China Sales Fall as Competition Heats Up,131774717,,TSLA,DowJones,Tesla’s China Sales Fall as Competition Heats Up,https://finnhub.io/api/news?id=2fb7b99adbba811adc915da9858efea9f12f8924aa7f9343ae6677ec66d5cba4,2024-12-03
company,1733197688,Tesla's China-made EV sales drop 4.3% y/y in Nov,131748690,,TSLA,Finnhub,"U.S. automaker Tesla's's sales of China-made electric vehicles fell 4.3% year-on-year to 78,856 in November, data from the China Passenger Car Association showed on Tuesday. Deliveries...",https://finnhub.io/api/news?id=30c934de933dbb31f246a8770dff54d6ecd0cbb735c730271d19fbb2f90f582c,2024-12-03
company,1733193784,Elon Musk's whopping 12-digit Tesla compensation package rejected again by Delaware judge,131747115,https://a57.foxnews.com/static.foxbusiness.com/foxbusiness.com/content/uploads/2024/04/1024/512/Elon-Musk-Tesla.jpg?ve=1&tl=1,TSLA,Yahoo,A judge rules Elon Musk is not entitled to receive the compensation package Tesla shareholders voted for. The package is worth $103 billion and consists of 303 million Tesla options.,https://finnhub.io/api/news?id=9891b601721f6d037e20d3e27fd4c4832e367bd1e9bfacd9bf49397d178c0002,2024-12-03
company,1733192100,Musk’s Multibillion-Dollar Pay Package Is Rejected Again by Judge,131747117,,TSLA,Yahoo,Tesla’s board had argued that a shareholder vote earlier this year addressed the court’s previous criticisms.,https://finnhub.io/api/news?id=d538b143ed55299012d681da150d172d64ee79d8cc9ccebc23739d5cd088bb5b,2024-12-03
company,1733189745,Musk’s Multibillion-Dollar Tesla Payout Gutted by Delaware Judge,131747119,https://s.yimg.com/ny/api/res/1.2/XITfGE3fgTIdxJZGQTqkSQ--/YXBwaWQ9aGlnaGxhbmRlcjt3PTEyMDA7aD04MDA-/https://media.zenfs.com/en/bloomberg_technology_68/c309494f9f37501916c549e9e8da3c7d,TSLA,Yahoo,"(Bloomberg) -- Elon Musk’s record-setting Tesla Inc. pay package was struck down once again by a Delaware judge, threatening to wrest billions of dollars from the world’s richest person and one of Donald Trump’s closest confidants.Most Read from BloombergRiyadh Metro Partially Opens in Bid to Ease City’s Traffic JamsAs Wars Rage, Cities Face a Dark New Era of Urban DestructionDelaware Chancery Court Judge Kathaleen St. J. McCormick ruled Monday that Tesla’s board was improperly influenced by Mus",https://finnhub.io/api/news?id=1ace98afe484266c889d97725c826e2940240f9a114cf1bfdb4a32d71f73b600,2024-12-03
company,1733186622,Explainer-What is next for Musk after judge rules against him in Tesla pay case?,131747121,https://media.zenfs.com/en/reuters-finance.com/843d6ff5a43524f839039ea07b86354b,TSLA,Yahoo,"Tesla cannot give Elon Musk a $56 billion compensation package despite a vote in support of the CEO's pay deal by the company's shareholders, a Delaware judge ruled on Monday.  Musk told a special committee of the Tesla board soon after a judge voided his compensation in January that he wanted a similar-sized replacement package, according to a securities filing.  In addition, earlier this year he said on his social media platform X that he wanted a larger stake in Tesla or he might develop some products outside the company.",https://finnhub.io/api/news?id=7f7f16bbe4d08795efa86109ac300b02f055c3e2fb50dfc9fa3e2a54f853dd62,2024-12-03
company,1733183989,Delaware court to Elon Musk: you still can't have $56 bln pay,131746615,,TSLA,Finnhub,STORY: Elon Musk still can't have his $56 billion pay package. That was the ruling from a Delaware judge on Monday. The case involves the largest-ever compensation...,https://finnhub.io/api/news?id=723bf5a00b48c9bd6d9eb0c15f488c56b72cdd3acd88f779ec2c9ad8c87b4364,2024-12-02
company,1733183660,"Elon Musk’s massive, multibillion-dollar Tesla pay package was blocked by a judge again",131747122,"https://media.cnn.com/api/v1/images/stellar/prod/2024-11-19t112000z-427445120-rc2f4bazdq7j-rtrmadp-3-usa-trump-federal-workers.JPG?c=16x9&q=w_800,c_fill",TSLA,Yahoo,"Elon Musk’s record-breaking pay package for serving as Tesla’s CEO was rejected on Monday by a Delaware court, despite being approved by Tesla shareholders at a June meeting.",https://finnhub.io/api/news?id=33bef4c0826202f3db622a1de89fba32b5bbeb91dffbfd5a6b40210f25b46f62,2024-12-02
company,1733183480,Delaware judge refuses to reinstate Elon Musk's $56 billion Tesla pay,131747124,https://s.yimg.com/ny/api/res/1.2/HnUE.uvD__gzsdRYuqQemA--/YXBwaWQ9aGlnaGxhbmRlcjt3PTEyMDA7aD04MDI-/https://s.yimg.com/os/creatr-uploaded-images/2024-11/d9b1aac0-ab44-11ef-abfc-f0915716caf7,TSLA,Yahoo,"The Delaware judge who denied Tesla CEO Elon Musk a $56 billion compensation package once did so for a second time on Monday, dealing a fresh legal defeat to the billionaire.",https://finnhub.io/api/news?id=79c98e672a505a8f28eb74adb4ed470605728110f74a472502bb1e9056ce94d1,2024-12-02
company,1733182974,"Dow Jones Futures: S&P 500, Nasdaq Hit New Highs; AI Stock Credo Soars 34% On Earnings",131774446,,TSLA,DowJones,"Dow Jones Futures: S&P 500, Nasdaq Hit New Highs; AI Stock Credo Soars 34% On Earnings",https://finnhub.io/api/news?id=a4112b1cee5cbd3d8f1750d892b0b0a1f23167d774f402b4810eb0fb44014fc8,2024-12-02
company,1733182517,SpaceX Weighs Tender Offer at Roughly $350 Billion Valuation,131747125,https://s.yimg.com/ny/api/res/1.2/J0H3Z8ffHkQtnC6ko_afOw--/YXBwaWQ9aGlnaGxhbmRlcjt3PTEyMDA7aD04MDA-/https://media.zenfs.com/en/bloomberg_technology_68/6e690773c2fe863cce723c8c45b9ec2c,TSLA,Yahoo,"(Bloomberg) -- SpaceX is in discussions to sell insider shares that could boost the value of Elon Musk’s rocket and satellite company to around $350 billion, according to people familiar with the matter. Most Read from BloombergRiyadh Metro Partially Opens in Bid to Ease City’s Traffic JamsAs Wars Rage, Cities Face a Dark New Era of Urban DestructionThat would be a significant premium to a previously mulled valuation of $255 billion as reported by Bloomberg News and other media outlets just last",https://finnhub.io/api/news?id=dbca7e6e3bc97b7b02a8987988a58f80b234267e29dd50126678aef1b0b64333,2024-12-02
company,1733181606,Musk dealt legal defeat in battle over $56bn Tesla pay deal,131747126,,TSLA,Yahoo,"Elon Musk has lost a legal bid to reinstate his huge $56bn pay deal at Tesla, even after shareholders backed the deal.",https://finnhub.io/api/news?id=e2006f1681018e4c5e489b2164e6d28730cce97cd9763fcaaacdf6d8163769dd,2024-12-02
company,1733181300,Elon Musk's $56 billion pay package is rejected,131747127,https://media.zenfs.com/en/quartz.com/bc78a6253acd92b6283d2e533aeaf4eb,TSLA,Yahoo,"Elon Musk’s $56 billion pay package was rejected by a Delaware judge on Monday after a motion to revise was denied. The ruling follows a legal challenge against the 2018 compensation plan, which Tesla (TSLA) shareholders initially contested, claiming it was improperly granted.",https://finnhub.io/api/news?id=eaeb58b83cf26a3543fa43884143b36f1518adda9309e55af59a9dcbcc66f59b,2024-12-02
company,1733180906,Court Again Strikes Down Elon Musk's Tesla Pay Package Valued at More Than $50 Billion,131747128,https://www.investopedia.com/thmb/9pOjO9YPuhTk19FsH2rwKfsnOWY=/1500x0/filters:no_upscale():max_bytes(150000):strip_icc()/GettyImages-1499013229-3ed9a39142c84dfabd41e5a3aab950f1.jpg,TSLA,Yahoo,Shares of Tesla slipped in after-hours trading following the news that a Delaware judge for a second time moved to strike down a multibillion-dollar pay package for CEO Elon Musk.,https://finnhub.io/api/news?id=e1c68f2ccd6141dcd90df8df35d377c334a20da21de5fff4b5ecebfbe47282fe,2024-12-02
company,1733180760,Elon Musk Pay Package Rejected by Judge Again. ‘This Is a Twilight Zone Situation.’,131747129,,TSLA,Yahoo,Now this is getting just weird for  Tesla  and its shareholders.  Tesla stock was dropping in after-hours trading Monday after Delaware Chancery Court judge Kathaleen McCormick rejected Elon Musk’s pay package for a second time.  The new rejection comes after a second shareholder vote designed to address the judge’s problems with the first vote.,https://finnhub.io/api/news?id=88873d2a25518d8fa8ddef228662684a24ae39e71c83c0caa1767007b080ea70,2024-12-02
company,1733179188,Delaware judge reaffirms ruling that invalidated massive Tesla pay package for Elon Musk,131747130,https://s.yimg.com/ny/api/res/1.2/nDMED27qggVcxs4XYU6_Uw--/YXBwaWQ9aGlnaGxhbmRlcjt3PTEyMDA7aD04MDI-/https://media.zenfs.com/en/ap_finance_articles_694/3800c6ad3dee5cd6d1a6e82f56bc3fae,TSLA,Yahoo,"Chancellor Kathaleen St. Jude McCormick on Monday denied a request by attorneys for Musk and Tesla’s corporate directors to vacate her ruling earlier this year requiring the company to rescind the unprecedented pay package.  McCormick also rejected an equally unprecedented and massive fee request by plaintiff attorneys, who argued that they were entitled to legal fees in the form of Tesla stock valued at more than $5 billion.",https://finnhub.io/api/news?id=c044542c4353a69bb3d998dfbd01ea2902c7a4b98fe357c4a320af1d828c2d93,2024-12-02
company,1733178943,A Delaware judge has reaffirmed her ruling that Tesla must revoke Elon Musk’s multibillion-dollar pay package,131747131,https://s.yimg.com/cv/apiv2/social/images/yahoo_default_logo-1200x1200.png,TSLA,Yahoo,A Delaware judge has reaffirmed her ruling that Tesla must revoke Elon Musk's multibillion-dollar pay package.,https://finnhub.io/api/news?id=7dc9ee6d5e8b2059b3cde6f3a6662c53f50ebdbab381d0954d655e76f77db684,2024-12-02
company,1733177206,Trump's FCC pick Brendan Carr: What it means for Big Tech,131743740,https://s.yimg.com/ny/api/res/1.2/qfXJTzsBK4HTnIzF7uqCNQ--/YXBwaWQ9aGlnaGxhbmRlcjt3PTEyMDA7aD02NzU-/https://s.yimg.com/os/creatr-uploaded-images/2024-12/59e43cd0-b0f9-11ef-bbee-a27171da9c9e,TSLA,Yahoo,"President-elect Donald Trump has tapped Brendan Carr to lead the Federal Communications Commission (FCC). The move has sparked interest among investors who are anticipating a potentially more tech-friendly regulatory landscape under the Trump administration. Yahoo Finance Senior Legal Reporter Alexis Keenan examines Carr's perspectives and potential implications for the technology sector. To watch more expert insights and analysis on the latest market action, check out more Market Domination Overtime here. This post was written by Angel Smith",https://finnhub.io/api/news?id=d18b87d9e18d5fcaec09c6eb6e8a05a353f96cef244dff5e2fa27ca49b8e5d99,2024-12-02
company,1733176568,Delaware judge rejects Musk's $56 billion Tesla pay - again,131747135,https://media.zenfs.com/en/reuters.com/8b8109e85eb7ea79ac23b2167aaf7f7f,TSLA,Yahoo,"WILMINGTON, Delaware (Reuters) -A Delaware judge ruled on Monday that Tesla CEO Elon Musk still is not entitled to receive a $56 billion compensation package despite shareholders of the electric vehicle company voting in June to reinstate it.  The ruling by the judge, Chancellor Kathaleen McCormick of the Court of Chancery, follows her January decision that called the pay package excessive and rescinded it, surprising investors, and cast uncertainty over Musk's future at the world's most valuable carmaker.  In a post on X after the decision, Musk said that ""shareholders should control company votes, not judges.""",https://finnhub.io/api/news?id=2749c618c5ad03a7191a1b03fa565fe4b084a97cb7d9f48a2c664d29f359ba1a,2024-12-02
company,1733174460,"These Stocks Moved the Most Today: Super Micro, Intel, Tesla, Stellantis, Upstart, Gap, Norwegian, and More",131743744,,TSLA,Yahoo,"Super Micro stock rises sharply after the server maker says it completed an investigation into accounting issues and found no evidence of fraud or misconduct by management, Intel CEO Pat Gelsinger retires, and Tesla rolls out the latest version of its self-driving software.",https://finnhub.io/api/news?id=f118b34e6c07a69bbf155e1bf9ef245e1cc2b53fb975e64ca4e1d83b10739919,2024-12-02
company,1733173841,You must 'believe' in 'long-term vision' to buy Tesla stock: Analyst,131747139,https://s.yimg.com/ny/api/res/1.2/1EUtvpZTHZRnQn6xEV7d2Q--/YXBwaWQ9aGlnaGxhbmRlcjt3PTEyMDA7aD02NzY-/https://s.yimg.com/os/creatr-uploaded-images/2024-12/b7be0ce0-b0f0-11ef-9ffe-082a905cc0e8,TSLA,Yahoo,"Stifel has increased its price target for Tesla (TSLA) from $287 to $411 while maintaining a Buy rating. Stifel NextGen Transport Analyst Stephen Gengaro joined Market Domination to explain the rationale behind this significant boost. Gengaro emphasized that Tesla is ""way more than an auto company,"" citing the company's autonomous driving capabilities and Cybercab initiatives as key factors behind the increased price target. Discussing these developments, Gengaro advised that ""you have to believe in the medium to long-term vision to buy the stock."" He pointed to the upcoming robotaxi deployment and the eventual transition to fully autonomous driving as crucial long-term investment considerations. ""We look at the long-term value in the name, and we're discounting pretty heavily back the expectations for those two businesses,"" Gengaro explained to Yahoo Finance, highlighting Stifel's measured approach to valuing Tesla's future ventures. To watch more expert insights and analysis on the latest market action, check out more Market Domination here. This post was written by Angel Smith",https://finnhub.io/api/news?id=9f466aeb4d602d9ac3bb49eebcc4d3d568416ec03c90f9b33182b5e700104e24,2024-12-02
company,1733160132,Is Tesla Stock A Buy As Investors Bet On The Donald Trump Effect And Autonomous Driving?,131740905,,TSLA,Yahoo,"Tesla is on a 37% tear since Donald Trump's election win, as investors speculate that self-driving is coming soon, with the Trump administration easing the regulatory path for autonomous vehicles.  Stifel on Monday hiked its Tesla stock price target to 411, up 287, essentially all on a ""clearer path"" for the Cybercab, or robotaxi, and Tesla's Full Self-Driving, FSD, technology.  Tesla stock also received an upgrade to a buy rating, up from neutral, from Roth MKM on Monday.",https://finnhub.io/api/news?id=06a385d58a30f0a3f76e7e08e9d99d058e81296a461c1ac770152623ee4bea33,2024-12-02
company,1733172060,Delaware judge reaffirms ruling rejecting Elon Musk’s massive Tesla pay package,131774742,,TSLA,MarketWatch,Delaware judge reaffirms ruling rejecting Elon Musk’s massive Tesla pay package,https://finnhub.io/api/news?id=202c6c5a8dab91823a5bf7893d36fcfc6cdf15797bdbd245d2cadfcee5bdf642,2024-12-02
company,1733168622,What is next for Musk after judge rules against him in Tesla pay case?,131744314,,TSLA,Finnhub,"Tesla cannot give Elon Musk a $56 billion compensation package despite a vote in support of the CEO's pay deal by the company's shareholders, a Delaware judge ruled on Monday. Below is a...",https://finnhub.io/api/news?id=92549526b10ebf9ce0f596550b40885c83f89a25ba78f094f7342cb0901980af,2024-12-02
company,1733161063,Tech Advances on Holiday Sales Optimism - Tech Roundup,131743412,,TSLA,Finnhub,"Shares of technology companies rose amid signs of a strong weekend for digital shopping. Shopify reported $5 billion in Black Friday gross merchandise volume, up 22% year-over-year, in line with...",https://finnhub.io/api/news?id=ef91b2c89472a944832040baa10999195fedec8908075b884e1b8964a03c6db1,2024-12-02
company,1733156173,Stock Market Today: Dow Jones Dips As Intel Fades After CEO Exit; This Warren Buffett Stock On 44% Run Clears Entry (Live Coverage),131774448,,TSLA,DowJones,Stock Market Today: Dow Jones Dips As Intel Fades After CEO Exit; This Warren Buffett Stock On 44% Run Clears Entry (Live Coverage),https://finnhub.io/api/news?id=7b076671692107d9400c74a7f5981a1f26ca093ce5dc3ca0c7e65a2a2d8cb20e,2024-12-02
company,1733155550,Jim Cramer on Tesla (TSLA): ‘I’d Be A Buyer On Weakness Though Because I’m A Believer In Musk’s Leadership’,131739096,https://s.yimg.com/ny/api/res/1.2/R3DsTXHuX1Up50du0B.awA--/YXBwaWQ9aGlnaGxhbmRlcjt3PTEyMDA7aD02NzM-/https://media.zenfs.com/en/insidermonkey.com/1277c6032fd09b727a10249a170024cf,TSLA,Yahoo,"We recently published an article titled Jim Cramer Thinks These 13 Stocks Will Benefit From the New Administration. In this article, we are going to take a look at where Tesla, Inc. (NASDAQ:TSLA) stands against the stocks that will benefit from the new administration according to Jim Cramer. Jim Cramer, the host of Mad Money, recently […]",https://finnhub.io/api/news?id=87c0c5eb7c4291fb1887f0542ac02dbc63c99b182e966aa6ee5618b10d3642b1,2024-12-02
company,1733154692,"Tesla, BYD raising EV discounts in China in year-end sales push",131739097,https://s.yimg.com/ny/api/res/1.2/Eb.RI6LA98248WPvCrPPjg--/YXBwaWQ9aGlnaGxhbmRlcjt3PTEyMDA7aD02NzY-/https://s.yimg.com/os/creatr-uploaded-images/2024-11/802f5940-b0c4-11ef-beff-fddb837f66cf,TSLA,Yahoo,"EV automakers Tesla (TSLA) and BYD (1211.HK, BYDDY) are offering vehicle discounts and incentives to boost year-end sales in Chinese markets. Catalysts hosts Seana Smith and Madison Mills discuss the analyst coverage around Tesla. To watch more expert insights and analysis on the latest market action, check out more Catalysts here. This post was written by Luke Carberry Mogan.",https://finnhub.io/api/news?id=a220064c1bf305904cd80a96d7dfe8d0997e4a698855464e0fb40940e03801c3,2024-12-02
company,1733153460,A Tesla rival now builds stuff for Apple,131739098,https://media.zenfs.com/en/quartz.com/35250d8227b315b41ec1a349dfd3624f,TSLA,Yahoo,Tesla’s biggest competitor has a side hustle assembling iPads.,https://finnhub.io/api/news?id=ab5d1b7a9eb8ef6273bf639035de0b9238f8da292110107d400ceab8c41b3e77,2024-12-02
company,1733153121,Tesla updates include Apple Watch app and fart prank,131739099,"https://techcrunch.com/wp-content/uploads/2024/12/tesla-fart-prank.jpeg?resize=1200,661",TSLA,Yahoo,"Tesla has revealed an app designed for the Apple Watch and says it should be live by next week. The Tesla app for the Apple Watch will do much of what the smartphone app does – it doubles as a key, can open up the trunk or the frunk, activate climate control, and show battery charge level. Rendering of Tesla's new Apple Watch app.Image Credits:Tesla Tesla announced the app as part of a large swathe of updates; we counted 18 large updates and eight minor updates. They include the ability to watch",https://finnhub.io/api/news?id=3b78d4ac993e9522a236187fe5542ba9306600bb88278ccbb86a23d887405ff2,2024-12-02
company,1733137800,"These Stocks Are Moving the Most Today: Tesla, Super Micro, Stellantis, XPeng, Nvidia, Upstart, and More",131737089,,TSLA,Yahoo,"Tesla rolls out the latest version of its self-driving software, the CEO of Stellantis resigns amid lower sales at the auto maker, and Super Micro stock extends losses.",https://finnhub.io/api/news?id=993a3dbdaa9e018e0a3b3cda43199c58f7881be7b885ad5944f2368e6c50e0e0,2024-12-02
company,1733151632,"Tesla investors, analysts have questions on the potential of robotaxis and self-driving",131739101,https://s.yimg.com/os/creatr-uploaded-images/2024-11/fb5107e0-ab5b-11ef-967e-60240391218d,TSLA,Yahoo,"President-elect Donald Trump is reportedly planning federal regulations for self-driving vehicles, and Tesla investors, analysts, and legal experts are mixed on the outlook.",https://finnhub.io/api/news?id=f6fbcf06d87569870a98d0aeffad3749e27942fd9dd521271d74db33415e43a7,2024-12-02
company,1733151015,5 companies that own the most Bitcoin,131739102,https://media.zenfs.com/en/quartz.com/ef8203baa83415e2d4f89f26a9aae9e1,TSLA,Yahoo,"Bitcoin has evolved into a powerful financial instrument, garnering attention not only from everyday individuals but also from major corporations. Over the years, many publicly traded companies have become enthusiastic supporters of Bitcoin, recognizing its potential as a transformative asset. These organizations are not just investors; they are active advocates for the cryptocurrency ecosystem, contributing directly or indirectly to the development and growth of the broader crypto landscape.",https://finnhub.io/api/news?id=28a35d050bf14a83c25ab8cb60f47f5b87512f9551065980b549ded1eff8810d,2024-12-02
company,1733151000,Tesla Stock Rises After Huge Price Target Increase. Why Analysts Are Excited.,131739103,https://media.zenfs.com/en/Barrons.com/12ea0f43d8f8307249a68d1cb2e0587e,TSLA,Yahoo,"On Sunday, Stifel analyst Stephen Gengaro raised his Tesla stock price target to $411 from $287. He kept his Buy rating.",https://finnhub.io/api/news?id=2ec523ff0e627a5568481ab5868b80e10329c4e348dbfdd24b159785997f46b9,2024-12-02
company,1733148765,Tesla's Self-Driving Narrative Is Falling Apart,131741134,https://static.seekingalpha.com/cdn/s3/uploads/getty_images/1178244881/image_1178244881.jpg?io=getty-c-w1536,TSLA,SeekingAlpha,"Learn why Tesla, Inc.'s valuation is at risk due to its struggles with self-driving technology, facing competition from Waymo. Click for my TSLA update.",https://finnhub.io/api/news?id=ce4bfc8ef73820f029177a5d9ea8e23da524e04ddd8af64db386606a6f5a56ac,2024-12-02
company,1733148438,Check out November's biggest stock market winners (and losers!),131738307,,TSLA,Yahoo,Stocks generally enjoyed one of the best months of the year. Here's what else you should know about the markets into year-end.,https://finnhub.io/api/news?id=c4fa79df45181d8397b814fa3a3542397e4c68b8673f0b2075d919aa1dfb1cc6,2024-12-02
company,1733145900,November Turns S&P 500's Best Month in 2024: ETF Area Winners,131738429,https://media.zenfs.com/en/zacks.com/337463349413cd4671be0d81c4416371,TSLA,Yahoo,November was the best month of 2024 for the Dow Jones and the S&P 500.,https://finnhub.io/api/news?id=10a53bf782ec310e0bc0a0b1eb211c528431e772c621292b5b61be24481bafdb,2024-12-02
company,1733144752,Good News for Tesla: Chair to Lead Australia's First R&D Review in Two Decades,131739108,https://media.zenfs.com/en/us.finance.gurufocus/a435ffed6659b01b3c49b19e1012d253,TSLA,Yahoo,Australia Taps Tesla Chair for R&D Reform Amid Global Innovation Race,https://finnhub.io/api/news?id=246b9fe2bffba8d8d3b9dc64e218ec011545c77b874674622e7cd781fee9c03f,2024-12-02
company,1733143680,Tesla and BYD Slash Prices in China. A Price War Is the Latest Move in Battle for EV Supremacy.,131739109,,TSLA,Yahoo,"Tesla and its Chinese rival BYD Co. have reignited their price war, with both EV makers offering big discounts as they battle for supremacy in the world’s biggest auto market.",https://finnhub.io/api/news?id=65029bc6abf70570eef035e60968a862a2c409ea1c53c0c1d6b7a5add515b31d,2024-12-02
