category,datetime,headline,id,image,related,source,summary,url,date
company,1730288415,BYD Revenue Eclipses Tesla for First Time as EV Giants Go Head to Head,130850062,,TSLA,Yahoo,"(Bloomberg) -- BYD Co. notched up another win over Tesla Inc. on Wednesday, reporting quarterly revenue that beat Elon Musk’s carmaker for the first time since the pair have gone head-to-head in global electric vehicles sales.Most Read from BloombergNY Transit Agency Takes Next Step on Brooklyn-Queens Rail LinkThere Will Soon Be No Meatpackers Left in NYC’s Historic Meatpacking DistrictInside NYC’s Playbook for Getting Federal Grant FundsA South Korean City Plays Matchmaker to Tackle a Fertility",https://finnhub.io/api/news?id=8ff86fb05012c9f2aca432d7d8b00bd65b2446bbe5247e4bece03b20686387af,2024-10-30
company,1730289360,Cocoa Prices Have More Than Doubled,130859390,https://g.foolcdn.com/editorial/images/795626/mfm_25.jpg,TSLA,Yahoo,Odds are this Halloween you'll see less chocolate being handed out as treats.,https://finnhub.io/api/news?id=27960eff3c85b7fcc8302c61bd7bbff56667b45d92ebc514b5cae78b73144373,2024-10-30
company,1730286660,Scientists Urge Pause on New Broadband Satellites Due to Environmental Concerns,130939807,,TSLA,GuruFocus,Looking for stock market analysis and research with proves results? Zacks.com offers in-depth financial research with over 30years of proven results.,https://finnhub.io/api/news?id=af840182e738c92075b1134fbb68e7c380c533bb8bfbeae10587edbea8222d91,2024-10-30
company,1730284980,Alphabet's Earnings Rally Pushes Magnificent 7 Market Cap To Record $16.8 Trillion: 10 Tech-Heavy ETFs Moving Wednesday,130853965,,TSLA,Benzinga,Looking for stock market analysis and research with proves results? Zacks.com offers in-depth financial research with over 30years of proven results.,https://finnhub.io/api/news?id=b5b25df22a81266ba04f1858f3824df96a5745988a438a759f27245764055fdc,2024-10-30
company,1730284800,1 Chart That Shows Why Tesla Is Still Overvalued,130873878,https://g.foolcdn.com/editorial/images/795417/tesla-model-3.jpg,TSLA,Yahoo,Weakness in the EV market could spoil Tesla's recent recovery.,https://finnhub.io/api/news?id=384d45494075f4bf629c2602023107fb2f77bf551dfb7ff3825858a7ad12e7a1,2024-10-30
company,1730283780,"VOO ETF Update, 10/31/2024???",130880503,,TSLA,TipRanks,Looking for stock market analysis and research with proves results? Zacks.com offers in-depth financial research with over 30years of proven results.,https://finnhub.io/api/news?id=60cc84d6a5d128f3e0dd1103d1e2f2b0f1781f6f61266e7fb1f90b8ac9daa832,2024-10-30
company,1733431620,Republicans Embrace DOGE on Capitol Hill,131803601,,TSLA,Yahoo,Lawmakers pledged to work closely with Trump allies Elon Musk and Vivek Ramaswamy to streamline the federal government.,https://finnhub.io/api/news?id=fb1344ccefa02dfcbc14061be9c4815195f434ab2fa211a09ebc8fa987489654,2024-12-05
company,1733435359,Uber and Lyft Stocks Plunge As Google's Waymo Brings Driverless Taxis to Miami,131803592,https://www.investopedia.com/thmb/KY4NAZBaRA6NOUWGzboeSx3_tUQ=/1500x0/filters:no_upscale():max_bytes(150000):strip_icc()/GettyImages-938757682-9aa99a5f0d604eed8604aa489f4c6561.jpg,TSLA,Yahoo,"Google said it is bringing its Waymo self-driving taxis to Miami, news that sent Uber and Lyft stock prices lower as investors weighed the risk to their services.",https://finnhub.io/api/news?id=fb4f100db6f8aeef084012cfa5d7bdc6fe6ffc6cd458bb17aaff43b11a68df77,2024-12-05
company,1733433110,Why Tesla Stock Is Jumping Today,131802315,https://g.foolcdn.com/editorial/images/800049/gettyimages-1248262649.jpg,TSLA,Yahoo,Tesla stock has now soared 53% higher over the last month of trading.,https://finnhub.io/api/news?id=5a72d18e3a7df5477540e263b33c122549b2d120549258473987ec0b5d6476d0,2024-12-05
company,1733432292,Tesla stock gets price target bump to $400 by BofA analysts,131802316,https://s.yimg.com/ny/api/res/1.2/ZwsKHOP9hEroYrkphz_HlA--/YXBwaWQ9aGlnaGxhbmRlcjt3PTEyMDA7aD02NzY-/https://s.yimg.com/os/creatr-uploaded-images/2024-11/5b652890-b34b-11ef-a7ff-ebcf76b844c1,TSLA,Yahoo,"After Bank of America Securities analysts reiterated their Buy rating after a visit to the EV maker's gigafactory in Austin, Tesla (TSLA) shares are rising by over 3%. The team, led by analyst John Murphy, also raised its price target on Tesla to $400 per share. Julie Hyman and Josh Lipton report more on the analyst commentary. To watch more expert insights and analysis on the latest market action, check out more Market Domination here. This post was written by Luke Carberry Mogan.",https://finnhub.io/api/news?id=ce2d6f678a97878ddb42ff08d5343d05869a3ccc3b349ef8fc853093b452eb05,2024-12-05
company,1733431988,"Jim Cramer on Tesla, Inc. (TSLA) CEO Elon Musk: ‘He May Be The Most Important Man In America For All I Know, As Long As He Stays Tight With Trump’",131802318,https://s.yimg.com/ny/api/res/1.2/R3DsTXHuX1Up50du0B.awA--/YXBwaWQ9aGlnaGxhbmRlcjt3PTEyMDA7aD02NzM-/https://media.zenfs.com/en/insidermonkey.com/1277c6032fd09b727a10249a170024cf,TSLA,Yahoo,"We recently published an article titled Jim Cramer Discussed 10 Stocks That Can Do Well in December.In this article, we are going to take a look at where Tesla, Inc. (NASDAQ:TSLA) stands against the other stocks that can do well in December according to Jim Cramer. Jim Cramer, the host of Mad Money, recently shared […]",https://finnhub.io/api/news?id=e5f5f6a83710c2336e1584ed650f3afc9b870007afaecad3130f14661b9a2fba,2024-12-05
company,1733429141,Elon Musk's xAI lands $6B in new cash to fuel AI ambitions,131802320,"https://techcrunch.com/wp-content/uploads/2024/07/GettyImages-2158243831.jpg?resize=1200,675",TSLA,Yahoo,"xAI, Elon Musk's AI company, has raised $6 billion, according to a filing with the U.S. Securities and Exchange Commission on Thursday. Investors gave a minimum of $77,593, per the filing. 97 participated, but the document doesn't reveal their identities. The Wall Street Journal previously reported that Valor Equity Partners, Sequoia Capital, and Andreessen Horowitz were expected to contribute to the round, along with Qatar Investment Authority, Qatar’s sovereign-wealth fund. The new cash brings",https://finnhub.io/api/news?id=657fefa96274a948d4a9b150eae9eabda6e9c8174794e944db0b3241aa59ea01,2024-12-05
company,1733428644,Elon Musk’s DOGE benefits from being whatever people want it to be,131802321,https://s.yimg.com/ny/api/res/1.2/K6A98yVnSpL6CgW1Dz4rrA--/YXBwaWQ9aGlnaGxhbmRlcjt3PTEyMDA7aD04MDA-/https://s.yimg.com/os/creatr-uploaded-images/2024-11/83ab9140-b341-11ef-beff-e7e38ab7ae7a,TSLA,Yahoo,Elon Musk and Vivek Ramaswamy received a rapturous welcome to Capitol Hill Thursday as questions piled up about exactly what the goals are for their extra-governmental 'Department of Government Efficiency.',https://finnhub.io/api/news?id=abbf528c569626e4e332a3c2962fc2da1d7f78dfd495b02ed7eeb3817b096aaf,2024-12-05
company,1733428500,Tesla’s Fast-Selling Toy Bot Is Back,131802322,https://media.zenfs.com/en/Barrons.com/12ea0f43d8f8307249a68d1cb2e0587e,TSLA,Yahoo,"The $40 Tesla Bot Action Figure, a 7-inch toy version of Tesla’s Optimus robot, was available for purchase again on the auto maker’s website on Thursday.  Tesla  plans to make its life-size, autonomous Optimus robot available to outside companies to buy in 2026, CEO Elon Musk said in a post on X in July.  After the action figure version quickly sold out on the Tesla site last month, people were offering it for more than $1,000 on  eBay  As of Dec. 5, the prices ranged from between $100 and $250 there.",https://finnhub.io/api/news?id=34ca662eaf696ff6587de470efdc7cb265cf151c9e59aae9e0da6cfa271e0619,2024-12-05
company,1733424933,"Midday stock movers: Tesla, Dollar General, HP Enterprise, more",131802323,,TSLA,Yahoo,Here are the stocks making the biggest market moves midday.,https://finnhub.io/api/news?id=be33f2faab7f7a7c9d86c4e2628a8b8f0c3994d98ed7c593df70846fed233c2d,2024-12-05
company,1733424208,"Tesla stock rises, Lululemon & HPE earnings in focus: Yahoo Finance",131802324,https://s.yimg.com/ny/api/res/1.2/pYBYEcDK1sX_ZE425k3w8g--/YXBwaWQ9aGlnaGxhbmRlcjt3PTEyMDA7aD02NzU-/https://s.yimg.com/os/creatr-uploaded-images/2019-09/1af93af0-db18-11e9-bff7-e34690b9be52,TSLA,Yahoo,"Shares of Tesla (TSLA) are on the rise after Bank of America analyst John Murphy raised his price target on the stock from $350 to $400. Murphy boosted his price target after visiting the automaker’s Gigafactory in Austin, writing that the company is “well-positioned to grow in 2025+.” Other companies in focus this afternoon are Lululemon (LULU) and HPE (HPE), which will release their quarterly earnings reports later today. Other Yahoo Finance trending tickers include SoundHound AI (SOUN), Uber (UBER), and MicroStrategy (MSTR). Key guests include:3:05 p.m. ET - Michael Saylor, MicroStrategy Executive Chairman3:20 p.m. ET - Eric Freedman, U.S. Bank Asset Management Group Chief Investment Officer3:30 p.m. ET - Sassine Ghazi, Synopsys CEO3:45 p.m. ET - Anthony Scaramucci, SkyBridge Founder4:20 p.m. ET - David Swartz, Morningstar Equity Analyst",https://finnhub.io/api/news?id=e33e42f5f92aa5ce5fa26e72cc8dbafece2b98a61d9dc398f6fbf89421d322d7,2024-12-05
company,1733423222,Protecting a billionaire CEO costs millions. Here’s how the world’s biggest companies measure up,131803613,,TSLA,Yahoo,"In the aftermath of the UnitedHealthcare CEO’s killing, security is top of mind for major companies.",https://finnhub.io/api/news?id=1b3d1630e29e2b8c62d59d25031a9a3fd4c9e6a256da2087c53e7c670f48e44e,2024-12-05
company,1733422906,Another $400 Price Target Is Lifting Tesla's Stock Today,131802325,https://www.investopedia.com/thmb/_Hv6azw0D9LdxqQ2eBV59qdAUa0=/1500x0/filters:no_upscale():max_bytes(150000):strip_icc()/GettyImages-2155471226-44c75e676bfb4b7d9747ccb3afd33ad7.jpg,TSLA,Yahoo,Shares of Tesla rose Thursday after another Wall Street analyst issued a bullish outlook for the EV maker.,https://finnhub.io/api/news?id=6ac6764bdb03951e3426fdc2d82e66e46119f2b93be7b4643e80a0fa487f7a47,2024-12-05
company,1733421613,"'Big Short' Trader Danny Moses Gives Up On Shorting Tesla, Says It Is 'Very Difficult To Short A Name That Is Not Trading On Fundamentals'",131802326,https://media.zenfs.com/en/benzinga_79/ae70caaec963c3185aa0ebefd2c01e6b,TSLA,Yahoo,Moses Ventures founder and “Big Short” fame trader Danny Moses said on Tuesday that he does not have a short position in Tesla Inc. (NASDAQ:TSLA) anymore. What Happened: Moses has been short on Tesla at various times since Nov. 2016 when Tesla bought ...,https://finnhub.io/api/news?id=8b8d2812069eef5aa0b95578c874752f82b3ac06cb1f92f6efcf39196388ade9,2024-12-05
company,1733419638,Tesla stock pops as Giga Austin visit has BofA bullish,131795280,https://s.yimg.com/ny/api/res/1.2/v_fg3j662C9LTgQ6o0jfkQ--/YXBwaWQ9aGlnaGxhbmRlcjt3PTEyMDA7aD04MDE-/https://s.yimg.com/os/creatr-uploaded-images/2024-11/b3329320-b326-11ef-af96-cc58beb02f20,TSLA,Yahoo,"Tesla stock is popping today on the back of bullish comments from BofA Securities, with the firm’s analysts fresh off a Giga Austin factory visit.",https://finnhub.io/api/news?id=0ceb2031eb78229277a42a07474a9550d8044db7dd0dfcdbadd7b3a24a695322,2024-12-05
company,1733417868,"Tesla's $400 Price Target: AI, Robotaxis, and a Humanoid Robot Revolution",131795284,https://media.zenfs.com/en/us.finance.gurufocus/542083594bce6bf52c297e28d497334b,TSLA,Yahoo,"Bank of America's bold bet on Tesla: A game-changing mix of EV growth, FSD milestones, and Optimus robots.",https://finnhub.io/api/news?id=fcd5451e18736f037fd6531887409bddbe6d99d165fdc9b3ef910af2a9233630,2024-12-05
company,1733416260,"Tesla Inc. stock rises Thursday, outperforms market",131873623,,TSLA,MarketWatch,"Tesla Inc. stock rises Thursday, outperforms market",https://finnhub.io/api/news?id=2b3c8de9d38e3e28f939b075ea63746b01646f9454f3cbd9c482a4518b6b990b,2024-12-05
company,1733413860,Tesla Stock Rises as New Cybercab Details Emerge,131795286,https://media.zenfs.com/en/Barrons.com/12ea0f43d8f8307249a68d1cb2e0587e,TSLA,Yahoo,"The self-driving taxi should be relatively cheap to produce, comments from an engineer for the electric-vehicle company indicate.",https://finnhub.io/api/news?id=84140a4c885bfb1adb0dbbc540c1f96140f3de883a8454025a4709294e62afaf,2024-12-05
company,1733413148,BofA Raises Tesla Price Target Amid Growing Confidence in Long-Term Growth and Expansion Plans,131795287,https://media.zenfs.com/en/us.finance.gurufocus/a435ffed6659b01b3c49b19e1012d253,TSLA,Yahoo,"Bank of America raised Tesla's price target to $400 from $350, maintaining a ""Buy"" rating.",https://finnhub.io/api/news?id=994361cda62d31fbb34c721b4d23e2e5143971260a112741add3fdceab342338,2024-12-05
company,1733410500,Billionaires Are Only Getting Richer. Here’s Who Is Growing Their Wealth Fastest.,131873471,,TSLA,MarketWatch,Billionaires Are Only Getting Richer. Here’s Who Is Growing Their Wealth Fastest.,https://finnhub.io/api/news?id=9052ebdaa6a71273d4fd7a7097729409876363c46df623768a71ec582d08f0fa,2024-12-05
company,1733366460,"Bitcoin Hits $100,000, Lifted by Hopes of a Crypto-Friendly Washington",131773162,,TSLA,Yahoo,The world’s largest digital currency has staged an extraordinary rally since Election Day. Some market veterans see ironies in crypto’s embrace of political power.,https://finnhub.io/api/news?id=f3dc971a6f6762a30efc78daa807a38d3d798842476d82dbcaf1ad3d02e17b37,2024-12-05
company,1733408280,UnitedHealth Killing Puts Focus on Corporate Security,131873473,,TSLA,MarketWatch,UnitedHealth Killing Puts Focus on Corporate Security,https://finnhub.io/api/news?id=87fa85220035e380fe64f971ff00d79a85b500b6cd32268b6bd59aa1c4196499,2024-12-05
company,1733407320,TSLA & BYDDY Vie for EV Supremacy: Which Stock is Worth Buying Now?,131795290,https://media.zenfs.com/en/zacks.com/3cb5117fc22f5e37890d1860dcd61f9f,TSLA,Yahoo,"BYD stands out for its cost leadership and diversified product lineup, while Tesla shines in terms of innovation and long-term promise in autonomous technology.",https://finnhub.io/api/news?id=7ac2974fcba9e6f6e7b9a0a76f23a5431f1cf799756bd749f0281cc394c3cedc,2024-12-05
company,1733359020,Bezos Extends an Olive Branch to Trump and Musk,131772671,https://media.zenfs.com/en/Barrons.com/12ea0f43d8f8307249a68d1cb2e0587e,TSLA,Yahoo,"President-elect Donald Trump has promised tariffs on imported goods, which would drive up prices of goods on Amazon’s virtual shelves.",https://finnhub.io/api/news?id=000a283568041171cddf08aec58b693750c2008b56494a096969331cc951229d,2024-12-05
company,1733405640,BNY Mellon Global Equity Income Fund Q3 2024 Commentary,131797458,https://static.seekingalpha.com/cdn/s3/uploads/getty_images/2149260996/image_2149260996.jpg?io=getty-c-w1536,TSLA,SeekingAlpha,"BNY Mellon Global Equity Income Fund (Classes A and I at NAV) outperformed its benchmark index, the FTSE World Index, during the third quarter of 2024. Read more here.",https://finnhub.io/api/news?id=ec291ad44711770e5edc786a7ca3e2099580af986fced32aad0727fd1e233b17,2024-12-05
company,1733404795,GRID: AI And Data Center Demand Fuel The Rally (Upgrade),131797131,https://static.seekingalpha.com/cdn/s3/uploads/getty_images/1863301845/image_1863301845.jpg?io=getty-c-w1536,TSLA,SeekingAlpha,"GRID's portfolio is heavily weighted toward Industrials and Utilities, with a mix of domestic and foreign stocks. See why I upgraded GRID ETF from hold to buy.",https://finnhub.io/api/news?id=1d3c94de26b048807b19b250debf022419651491776842363b47802a54c3b9ad,2024-12-05
company,1733404394,"Salesforce CEO Marc Benioff: DOGE has a real shot at cutting costs, and new technologies could help",131795292,https://s.yimg.com/ny/api/res/1.2/zL3DlTHw3HuWLHae65oBJQ--/YXBwaWQ9aGlnaGxhbmRlcjt3PTEyMDA7aD04MDA-/https://s.yimg.com/os/creatr-uploaded-images/2024-12/1e295ec0-b309-11ef-bfaf-3e83764562dc,TSLA,Yahoo,"Elon Musk has a good shot at cleaning up government waste by way of DOGE, explains Salesforce co-founder and CEO Marc Benioff.",https://finnhub.io/api/news?id=74881fd45e121d38e9d3960fd338f98be3021671a672f48ed5477221f8346749,2024-12-05
company,1733403614,"Cybertruck Turns 1: If You Invested $1,000 In Tesla Stock When EV Truck Was Unveiled, Here's How Much You'd Have Today",131795293,https://media.zenfs.com/en/benzinga_79/bdc05a5aee57f7f9ae8fa401b51ee8fc,TSLA,Yahoo,"One of the most anticipated vehicle launches of all time happened on Nov. 30, 2023 with Tesla Inc (NASDAQ:TSLA) delivering its first Cybertruck vehicles to a long waiting list of reservation holders of the highly anticipated electric pickup ...",https://finnhub.io/api/news?id=9c8c838c8525a005616938ce654838abe1904c6729f3ae8014209512f92c3277,2024-12-05
company,1733401723,Tesla Hits New Highs as BofA Upgrades Price Target to $400,131795294,https://media.zenfs.com/en/us.finance.gurufocus/a435ffed6659b01b3c49b19e1012d253,TSLA,Yahoo,"Tesla's Stock Rockets, But Analysts Caution on Future AI Risks",https://finnhub.io/api/news?id=71aa714dc6353bd102f5c5cd78fac1f906acd36e6252712a211571f798afc9ba,2024-12-05
company,1733398870,Analyst revisits Tesla stock price target amid Optimus robotics push,131795295,,TSLA,Yahoo,Tesla's Optimus humanoid robot is already being deployed in the group's energy storage division.,https://finnhub.io/api/news?id=7c1ce415ced92fb7a33f1266405902a8eb5abe477d6bfabbd5902609f32114d3,2024-12-05
company,1733396415,Tesla : BofA raises its target price,131793041,,TSLA,Finnhub,"Bank of America on Thursday renewed its Buy recommendation on Tesla, while raising its price target on the stock from $350 to $400.The American broker says it emerged from a recent visit to the...",https://finnhub.io/api/news?id=34068fb810e7f26f0ed1582d7f5d3567716270afc272152613945d754eb2677b,2024-12-05
company,1733393189,"EVs, plug-in hybrids' reliability concerns ease but still lag gas-powered peers, survey shows",131792318,,TSLA,Finnhub,"Electric vehicles and plug-in hybrids are seeing concerns over their reliability easing but they still lag gas-powered vehicles, a survey by an influential U.S. non-profit organization showed on...",https://finnhub.io/api/news?id=f9c111993db8c601728d570a1de2be11d19e953d6fe7e36ff95a4ae0d5177c53,2024-12-05
company,1733393062,Dow Jones Rises After Jobless Claims; Nvidia Threatens Win Streak,131873281,,TSLA,DowJones,Dow Jones Rises After Jobless Claims; Nvidia Threatens Win Streak,https://finnhub.io/api/news?id=ebd9c6405b0b9b7cbe85431c4240f0e99fde5db4bbe2ad67c71319a725da5b0c,2024-12-05
company,1733392800,DOGE’s Big Ideas Include Ending Remote Work and Daylight Saving Changes,131795297,,TSLA,Yahoo,"The Department of Government Efficiency, or DOGE, begins its work in earnest Thursday when  Elon Musk  and  Vivek Ramaswamy  meet with House and Senate Republicans to discuss the incoming Trump administration’s effort to cut federal spending and regulations.  Musk, the world’s richest man and chief executive officer of  Tesla  and SpaceX, and Ramaswamy, a biotech entrepreneur who sought the 2024 GOP presidential nomination, have offered a range of ideas as “outside volunteers,” some granular and others sweeping, to constrain the government’s reach.  President-elect  Donald Trump  on Dec. 4 named  Bill McGinley,  White House cabinet secretary in the first Trump administration, to serve as counsel to DOGE.",https://finnhub.io/api/news?id=ed4dda9f50eff7127a84e9f0aa9af37367a0f447ee532d3c081040445a80e9ff,2024-12-05
company,1733392007,"Bitcoin Is Surging Above $100,000. Why That's Unleashing A New Wave Of Buyers.",131873600,,TSLA,DowJones,"Bitcoin Is Surging Above $100,000. Why That's Unleashing A New Wave Of Buyers.",https://finnhub.io/api/news?id=d05674f965fc924533732812e4a3764fe51a77a7e8745b92f2bf4fab5bf90a0c,2024-12-05
company,1733389219,Elon Musk is getting some (tentative) bipartisan interest as he heads to Capitol Hill,131795298,https://s.yimg.com/os/creatr-uploaded-images/2024-12/c448ec90-b286-11ef-9f2c-0dd17bcbdc26,TSLA,Yahoo,There are some stirrings of interest from across the aisle in the new extra-governmental 'Department of Government Efficiency' headed up by Elon Musk and Vivek Ramaswamy.,https://finnhub.io/api/news?id=80af03ee889e35d4cdd57b5e3e0e72525c1a69ccfc85f2afe583557d8f12ebc4,2024-12-05
company,1733358780,Tesla replaced by much smaller rival in EV charging project,131795299,,TSLA,Yahoo,A small EV charging company is proving better than Tesla at keeping costs low.,https://finnhub.io/api/news?id=69ad548ae6155eb9488b38bcb3e319ccf5e645f06e8b6c397d850ef6f3e627f4,2024-12-05
company,1733355204,Humanoid robots could create a $7 trillion market in the next 25 years: Citi analysts,131795300,https://s.yimg.com/ny/api/res/1.2/HQevZ0Eq1pL6bh7B7oNMyg--/YXBwaWQ9aGlnaGxhbmRlcjt3PTEyMDA7aD04MDA-/https://s.yimg.com/os/creatr-uploaded-images/2024-11/fdd35e10-b28f-11ef-bf7c-d63fe3addb0c,TSLA,Yahoo,"Humanoid robots could soon be a multitrillion-dollar market, according to a study published by Citi Global Insights analysts.",https://finnhub.io/api/news?id=1a6a45d59616e21166109a2d39733e0d38e8a842ce3d0e24948b7c9f8079764a,2024-12-04
company,1733351926,Elon Musk's multibillion-dollar pay package is rejected for a second time. What to know,131795301,https://media.zenfs.com/en/la_times_articles_853/808a87e4316ad4f2254a523b4a85bc8f,TSLA,Yahoo,"A Delaware judge rejected Tesla CEO Elon Musk's multibillion-dollar pay package again, writing that the company's approval process was 'deeply flawed.'",https://finnhub.io/api/news?id=f1952b8a565559e9632a6d1ce6230a0a8655fe863b86fd13f6b8fc835fbfc919,2024-12-04
company,1733351742,Magnificent Seven Stocks: Nvidia Stock Rallies; Amazon Hits New High,131774440,,TSLA,DowJones,Magnificent Seven Stocks: Nvidia Stock Rallies; Amazon Hits New High,https://finnhub.io/api/news?id=0c6a9940a0b578c639325b0e9f112041277ec6900c49185e8dabba8e98e2598f,2024-12-04
company,1733348520,"Tesla Stock Hits a New 52-Week High, Shakes Off Growth Concerns",131795303,https://media.zenfs.com/en/Barrons.com/12ea0f43d8f8307249a68d1cb2e0587e,TSLA,Yahoo,"Goldman Sachs analyst Mark Delaney doesn’t think EV maker's sales will grow in 2024. The bigger deal for investors, however, is 2025.",https://finnhub.io/api/news?id=2e0657500fc0a61f9c162eaab2ae98cd0a6272fad4f577563efa024ce60a2a11,2024-12-04
company,1733331614,What's Going On With Magnificent 7 Stocks?,131768340,https://media.zenfs.com/en/benzinga_79/9a94a89680defefe1ec2f47374f814b1,TSLA,Yahoo,"Aswath Damodaran, finance professor at New York Univerisity’s Stern School of Business, told Bloomberg Television on Monday that he recommends buying any of the Magnificent Seven stocks on dips. What To Know: Corrections will occur and ""I'd suggest ...",https://finnhub.io/api/news?id=926f84ef0377457307ec8bb0c83bc374fe70a9e4b13ba95565eb31dfe1a7bff4,2024-12-04
company,1733331300,MicroStrategy’s bitcoin bet has made its stock a big winner. Will other companies soon follow suit?,131774542,,TSLA,MarketWatch,MicroStrategy’s bitcoin bet has made its stock a big winner. Will other companies soon follow suit?,https://finnhub.io/api/news?id=d7bbed428bb49f6cad252d421925d27a7725ed71c5533d218aba69ef356041ac,2024-12-04
company,1733330719,"Musk's $119 Billion Wealth Increase Outpaces Dell and Zuckerberg, But Guess Who's Catching Up",131767886,https://media.zenfs.com/en/Benzinga/77430c347a92023bffff874ebf62bad6,TSLA,Yahoo,"Elon Musk is on another level this year. The Tesla and SpaceX CEO added $119 billion to his fortune in 2024. This pushed his net worth to $348 billion. That's not just a number. It's more than the entire net worth of tech icon Michael Dell. Let that sink in. Musk isn't alone in raking it in, though. The 10 biggest wealth gainers globally have seen their fortunes grow by a combined $585 billion this year, according to the Bloomberg Billionaires Index. For context, that's more than the market valu",https://finnhub.io/api/news?id=5a0f03681b677d06d054d179e60bb0d82601c62e9788cda84981f6c8c71cb51d,2024-12-04
company,1733330700,Is Sirius XM Finally a Tesla Stock Play?,131768342,https://g.foolcdn.com/editorial/images/799831/tesla-ev-electric-vehicle-charging-station.jpg,TSLA,Yahoo,The latest Tesla software update could be a boost to Sirius XM's sluggish subscriber base.,https://finnhub.io/api/news?id=f2c83bbfc39e97f6afccd9af9667140aa70320fba341591d74ad332dbbbf47a1,2024-12-04
company,1733330197,Tech's Santa Claus rally: Analyst sees AI party carrying into 2025,131768343,https://s.yimg.com/ny/api/res/1.2/ZaDQuvh6111DRL5y7wNaig--/YXBwaWQ9aGlnaGxhbmRlcjt3PTEyMDA7aD02NzY-/https://s.yimg.com/os/creatr-uploaded-images/2024-11/d6c45b30-b25d-11ef-af32-e6ff71fd6f72,TSLA,Yahoo,"A Santa Claus rally is coming for technology stocks, according to Wedbush analyst Dan Ives. The senior equity research analyst sees several factors driving the market darlings higher into the end of the year, ranging from expectations about loosened regulation from the incoming Trump administration to increased adoption of artificial intelligence (AI) by the US government. The analyst also sees the tech sector gaining by 20% through 2025. ""It's about the multiplier — for every dollar spent on Nvidia chip, there's an $8 to $10 multiplier across tech, across software, infrastructure, cybersecurity. That's why this is going to be a tech bull market that rages into next year,"" Ives explains to Morning Brief hosts Seana Smith and Brad Smith. ""Because now it's about the second [or] fourth-derivative. Because now software they're they're on the dance floor at the AI party, they're no longer waiting behind the velvet rope. And now other tech players are trying to get in cybersecurity infrastructure."" Ives also comments on Palantir's (PLTR) position in the so-called AI revolution, speculating that the company has the potential to the next Oracle (ORCL). To watch more expert insights and analysis on the latest market action, check out more Morning Brief here. This post was written by John Hyland.",https://finnhub.io/api/news?id=6683081506a2a4eb66aa6ce1c7b5533591347826e79d5aa37948ba55988e93e0,2024-12-04
